序號	客家語言	等級	腔調	類別	客語音標	華語辭義	英語詞義	客語例句	華語翻譯
033	牧師	初級	四縣	宗教信仰	mug  siiˊ	牧師	minister	牧師滿（一）哪仔去傳教。	牧師到處去傳教。
034	神父	初級	四縣	宗教信仰	siinˇ  fu	神父	father	神父做毋得結婚。	神父不可以結婚。
035	法師	初級	四縣	宗教信仰	fabˋ  siiˊ	法師	Master（courteous address for a Buddhist or Taoist monk）	法師講佛經，當（蓋）精彩。	法師講佛經，很精彩。
036	肖鼠	初級	四縣	宗教信仰	seu  cuˋ	屬鼠	born in the year of rat	肖鼠个人今年運數當（蓋）好。	屬鼠的人今年運勢很好。
037	肖牛	初級	四縣	宗教信仰	seu   ngiuˇ	屬牛	born in the year of ox	肖牛，吾姊肖豬。	我屬牛，我姊屬豬。
038	肖虎	初級	四縣	宗教信仰	seu   fuˋ	屬虎	born in the year of tiger	同吾爸共樣肖虎。	我和我爸爸一樣屬虎。
039	肖兔	初級	四縣	宗教信仰	seu   tu	屬兔	born in the year of rabbit	同學當中麼人肖兔？	同學當中誰屬兔？
040	肖龍	初級	四縣	宗教信仰	seu   liungˇ	屬龍	born in the year of dragon	吾屋下有兩儕肖龍。	我家有兩個人屬龍。
041	肖蛇	初級	四縣	宗教信仰	seu   saˇ	屬蛇	born in the year of snake	阿明哥肖蛇。	阿明哥屬蛇。
042	肖馬	初級	四縣	宗教信仰	seu   maˊ	屬馬	born in the year of horse	佢肖馬，就像馬仔恁會飆 。	他屬馬，就像馬那麼會跑 。
043	肖羊	初級	四縣	宗教信仰	seu   iongˇ	屬羊	born in the year of goat	佢肖羊，大家喊佢羊咩咩。	他屬羊，大家叫他羊咩咩。
044	肖猴	初級	四縣	宗教信仰	seu   heuˇ	屬猴	born in the year of monkey	聽講：肖猴个人手腳較（過）溜掠。	聽說：屬猴的人手腳比較靈活。
045	肖雞	初級	四縣	宗教信仰	seu   gieˊ	屬雞	born in the year of rooster	肖雞，民國八十二年出世。	我屬雞，民國八十二年生。
046	肖狗(肖犬)	初級	四縣	宗教信仰	seu   gieuˋ(seu  kienˋ)【seu kianˋ】	屬狗	born in the year of dog	有人講，肖狗个人較忠心。	有人說，屬狗的人比較忠心。
047	肖豬	初級	四縣	宗教信仰	seu zuˊ	屬豬	born in the year of hog	佢肖豬，厥倈仔肖猴。	他屬豬，他兒子屬猴。
001	仰般(仰仔)【仰吔】	初級	四縣	虛詞	ngiongˋ banˊ (ngiongˋ eˇ)【ngiongˋ eˊ】	怎樣	how	請問臺北車頭愛仰般(仰仔)行？	請問臺北車站要怎麼走？
002	仰結煞	初級	四縣	虛詞	ngiong  gadˋ sadˋ	怎麼辦；如何是好	What should I do?	錢跌忒吔，愛仰結煞？	錢掉了，要怎麼辦？
003	恁樣(恁呢)【恁吔】	初級	四縣	虛詞	anˋ ngiongˇ (anˋ neˇ)【anˋ neˊ】	這樣	like this; in this way	請問你恁樣(恁呢)做著無？	請問你這樣做對嗎？
004	幾時	初級	四縣	虛詞	gidˋsiiˇ【giˋ siiˇ】	何時	when	你幾時正愛來看？	你什麼時候才要來看我？
005	做得	初級	四縣	虛詞	zo  dedˋ	能；可以	may; can	這做得送無？	這可以送我嗎？
006	做得無	初級	四縣	虛詞	zo  dedˋ moˇ	可以嗎	Is that OK?	借過一下做得無？	借我過一下可以嗎？
007	做毋得	初級	四縣	虛詞	zo  mˇ dedˋ	不能；不可以	may not; can not	辦公室肚做毋得食煙。	辦公室裡不可以抽煙。
008	好得(好在)	初級	四縣	虛詞	hoˋdedˋ(hoˋ cai)	幸好	thanks to	好得有你手，正赴得着出貨。	幸好有你幫忙，才趕得上出貨。
009	法度	初級	四縣	虛詞	fabˋtu	辦法	way; means	同想，看有麼个法度無。	幫我想想，看有什麼辦法沒。
010	無法度	初級	四縣	虛詞	moˇ fabˋ tu	沒辦法	can't, no way	今晡日無閒，無法度去接你喔！	今天沒空，沒辦法去接你喔！
011	無採	初級	四縣	虛詞	moˇcaiˋ	白費	what a waste	無採對你恁好！	白費我對你這麼好！
012	會	初級	四縣	虛詞	voi	將要	soon to be	雞啼吔，天會光吔。	雞啼了，天快亮了。
013	定著	初級	四縣	虛詞	tin cog	一定	must	天光日你定著愛來分請喔！	明天你一定要來讓我請喔！
014	同(摎)【(合)】	初級	四縣	虛詞	tungˇ (lauˊ)【ganˋ】	和	with; and	佢同(合)厥爸出去逛街哩。	他和他爸爸出去逛街了。
015	因爭（因為）	初級	四縣	虛詞	inˊ zenˊ（ inˊ vi ）	因為	because	因爭（因為）鬧鐘仔(鬧鐘)壞忒(壞核)，故所無赴着。	我由於鬧鐘壞掉，所以沒趕上。
016	故所	初級	四縣	虛詞	gu  soˋ	所以	so	因爭考毋好，故所無出去尞。	因為考不好，所以沒出去玩。
017	毋過	初級	四縣	虛詞	mˇgo	不過	however	想係想，毋過無錢！	我想是想，不過沒錢！
018	雖然	初級	四縣	虛詞	suiˊ ienˇ【suiˊ ianˇ】	雖然	though	佢雖然生活苦，毋過當(蓋)有志氣。	他雖然生活苦，不過很有志氣。
019	敢係	初級	四縣	虛詞	gamˋ he	會是…嗎？	could it be	這支筆敢係若个？	這支筆會是你的嗎？
020	無成係	初級	四縣	虛詞	moˇ sangˇ he	難道是	Is it possible that…	這本書無成係佢寫个？	這本書難道是他寫的嗎？
021	抑係	初級	四縣	虛詞	ia  he	或者	or	這隻書包仔係若，抑係厥？	這個書包是你的，還是他的？
022	毋單淨…還	初級	四縣	虛詞	mˇdanˊqiang…hanˇ	不但…而且	not only…,but also…	這領衫毋單淨靚，還當（蓋）便宜。	這件衣服不但漂亮，而且很便宜。
023	可能	初級	四縣	虛詞	koˋ nenˇ	可能	possibly	佢目珠紅紅，可能正噭啊過。	他眼睛紅紅，可能才剛哭過。
024	為着	初級	四縣	虛詞	vi  doˋ	為了	in order to	為着愛拿獎學金，佢當（蓋）煞猛讀書。	為了要拿獎學金，他很努力讀書。
025	係講【係準、係準講、準講】	初級	四縣	虛詞	he  gongˋ【he  zunˋ、he  zunˋ gongˋ、zunˋ gongˋ】	如果	if	係講(係準)你想愛，做得摎(同)講。	如果你想要，可以跟我說。
026	撿採【假使】【若係】	初級	四縣	虛詞	giamˋ caiˋ【gaˋ siiˋ】（naˇ he ）	萬一	in case	撿採(若係)阿松無來，還有阿森做得手。	萬一阿松沒來，還有阿森可以幫忙。
027	還	初級	四縣	虛詞	hanˇ	還	still; yet; why	還毋較遽兜仔，會赴毋着吔！	還不快點，要趕不上了！
028	還	初級	四縣	虛詞	hanˇmangˇ	尚未	not yet	作業還吂寫好。	我作業還沒寫好。
029	另外	初級	四縣	虛詞	nang ngoi	另外	besides	除忒(除核)，你另外還有同麼儕（人）講？	除了我，你另外還跟誰說？
030	甚至（甚至於）	初級	四縣	虛詞	siimˋ  zii （siimˋ  zii  iˇ）	甚至	even	佢毋單止無慢到，甚至還提早到。	他不但沒遲到，甚至還提早到。
031	盡尾 （包尾、最尾）【臨尾】	初級	四縣	虛詞	qin miˊ(bauˊ miˊ、 zui miˊ)【linˋ miˊ】	最後	lastly; finally	你行頭前，佢行盡尾(臨尾)。	你走前面，他走最後。
032	高不將	初級	四縣	虛詞	goˊ budˋ jiongˊ	不得已	cannot help but	尋無藍筆好寫，高不將用紅筆。	找不到藍筆可寫，不得已用紅筆。
033	動啊着	初級	四縣	虛詞	tungˊa doˋ	動不動	easily; without any reason	毋好動啊着就噭！	不要動不動就哭！
001	係	初級	四縣	形容性狀	he	是	yes	這公文係你寫个無？	這公文是你寫的嗎？
002	毋係	初級	四縣	形容性狀	mˇ he	不是	no	這支鉛筆係吾个，毋係厥个。	這支鉛筆是我的，不是他的。
003	著	初級	四縣	形容性狀	cog	對	right; correct	講个正著。	我說的才對。
004	毋著	初級	四縣	形容性狀	mˇ cog	不對	wrong	到底著抑毋著？	到底對還是不對？
005	好	初級	四縣	形容性狀	hoˋ	良好	good	阿英妹當（蓋）會讀書，成績當（蓋）好。	阿英妹很會讀書，成績很好。
006	壞	初級	四縣	形容性狀	faiˋ【fai】	壞	bad	阿山叔脾氣當（蓋）壞，動啊着就罵人。	阿山叔脾氣很壞，動不動就罵人。
007	差	初級	四縣	形容性狀	caˊ	差	poor	差一息仔無相干。	差一點點沒關係。
008	有	初級	四縣	形容性狀	iuˊ	有	to have	臺北101，你有去過無？	臺北101，你去過嗎？
009	無	初級	四縣	形容性狀	moˇ	沒有	do not have; without	你忒慢到，無飯好食哩！	你太晚到，沒飯吃了！
010	有影	初級	四縣	形容性狀	iuˊiangˋ	真的	real, true	俗話講「隔夜茶毒過死蛇」，確實有影！	俗話說「隔夜茶比死蛇還毒」，確實如此！
011	無影	初級	四縣	形容性狀	moˇiangˋ	假的	false	聽講阿美仔著着一千萬个大獎，有影無影？	聽說阿美中了一千萬的大獎，真的還是假的？
012	敢有影	初級	四縣	形容性狀	gamˋiuˊiangˋ	真的嗎	Really?	聽講阿玉仔分頭家辭頭路吔，敢有影？	聽說阿玉被老闆開除了，真的嗎？
013	無影無跡	初級	四縣	形容性狀	moˇ iangˋ moˇ jiagˋ	不實謊言	untrue	大家講盡有錢，無影無跡！	大家說我很有錢，根本是假的！
014	在	初級	四縣	形容性狀	cai / coiˊ/ di / do/ qi【 tiˊ/ diˊ/ qiˊ】	在	in; at; on; to be present	刀嫲放在哪位？	柴刀放在哪裡？
015	共下	初級	四縣	形容性狀	kiung  ha	共同	together	佢兩兄弟共下去打球仔。	他兄弟倆一起去打球。
016	白色	初級	四縣	形容性狀	pag  sedˋ	白色	white	白色个衫當（蓋）驚骯髒。	白色的衣服很怕髒。
017	烏色	初級	四縣	形容性狀	vuˊsedˋ	黑色	black	考試做得用藍色同烏色个筆來寫。	考試可以用藍色和黑色的筆寫。
018	藍色	初級	四縣	形容性狀	lamˇ sedˋ【(namˇ sedˋ)】	藍色	blue	海水係藍色个。	海水是藍色的。
019	青色	初級	四縣	形容性狀	qiangˊ sedˋ	綠或藍色	green or blue	看青色个東西，對目珠較（過）好。	看綠色的東西，對眼睛比較好。
020	紅色	初級	四縣	形容性狀	fungˇ sedˋ	紅色	red	先生用紅色个筆改作業。	老師用紅色的筆改作業。
021	黃色	初級	四縣	形容性狀	vongˇsedˋ	黃色	yellow	落雨天著黃色个水衣，較（過）安全。	下雨天穿黃色的雨衣，比較安全。
022	灰色	初級	四縣	形容性狀	foiˊsedˋ	灰色	grey	老鼠一身灰色个打扮。	老鼠一身灰色的打扮。
023	吊菜色	初級	四縣	形容性狀	diau  coi  sedˋ	紫色	purple	厥姊買一隻吊菜色个書包仔分佢。	他姊姊買一個紫色的書包給他。
024	水紅色	初級	四縣	形容性狀	suiˋ fungˇ sedˋ	粉紅色	pink	桃仔樹開水紅色个花，盡靚。	桃樹開粉紅色的花朵，很漂亮。
025	豬肝色（茶色）	初級	四縣	形容性狀	zuˊ gonˊ sedˋ（caˇsedˋ）	赭色	brown	吾公戴一頂豬肝色个帽仔上街。	我爺爺戴一頂赭色的帽子上街。
026	光	初級	四縣	形容性狀	gongˊ	亮	bright	點日光燈較（過）光。	點日光燈比較亮。
027	暗	初級	四縣	形容性狀	am	暗	dark	間肚恁暗，愛點電火。	房間裡這麼暗，要開燈。
028	譴	初級	四縣	形容性狀	kienˋ	生氣	to anger	阿爸毋知譴麼个？	爸爸不知道在氣什麼？
029	膨風	初級	四縣	形容性狀	pong  fungˊ	吹牛	to brag	佢當(蓋)會膨風。	他很會吹牛。
030	交叉	初級	四縣	形容性狀	gauˊ caˊ	交叉	to cross; to intersect	地泥下有兩枝棍仔交叉放等。	地上有兩根棍子交叉放著。
031	歡喜	初級	四縣	形容性狀	fonˊ hiˋ	高興	glad	阿公今晡日看起來當（蓋）歡喜。	爺爺今天看起來很高興。
032	有名	初級	四縣	形容性狀	iuˊ miangˇ	有名	famous	這齣戲當（蓋）有名。	這齣戲很有名。
033	淰【滿】	初級	四縣	形容性狀	nemˊ 【manˊ】	滿	full	罐仔肚个水淰（滿）吔，毋使再過加。	罐子裡的水滿了，不必再加。
034	壞忒	初級	四縣	形容性狀	faiˋ tedˋ	壞掉	corrupt, rotten	這菜壞忒哩，倒忒佢。	這菜壞了，倒掉。
035	當萋【蓋萋】【蓋萋頭】	初級	四縣	形容性狀	dongˊ qiˊ 【goi qiˊ】【goi qiˊteuˇ】	很新鮮	very fresh	這尾魚仔係正釣个，當萋（蓋萋頭）。	這條魚才釣的，很新鮮。
036	生趣	初級	四縣	形容性狀	senˊ qi	有趣	interesting	這齣電影當（蓋）生趣。	這齣電影很有趣。
037	當好【蓋好、盡好】	初級	四縣	形容性狀	dongˊ hoˋ【goi hoˋ、qin hoˋ】	很好	happy	這擺考試，考到當(蓋)好。	這次考試，我考得很好。
038	盡好	初級	四縣	形容性狀	qin  hoˋ	最好	best	若班項成績盡好个係麼儕(人)？	你班上成績最好的是誰？
039	毋好	初級	四縣	形容性狀	mˇ hoˋ	不好	bad	食（）煙係毋好个習慣。	抽煙是不好的習慣。
040	方便(利便)	初級	四縣	形容性狀	fongˊ pien(li pien)	方便	convenient	臺北个交通盡（蓋）方便。	臺北的交通很方便。
041	特別	初級	四縣	形容性狀	tid  pied	特殊	special	你這領衫非常特別。	你這件衣服非常特別。
042	生个	初級	四縣	形容性狀	sangˊge	活的	alive; living	這尾魚仔係生个。	這條魚是活的。
043	死忒个	初級	四縣	形容性狀	xiˋtedˋge	死的	dead	死忒个魚仔會變色。	死的魚會變色。
044	真實	初級	四縣	形容性狀	ziinˊsiid	真實	real, true	你講个係真實个無？	你說的是真的嗎？
045	孤栖	初級	四縣	形容性狀	guˊ xiˊ	孤獨	lonely	佢一個人歇，當（蓋）孤栖。	他一個人住，很孤獨。
046	大聲	初級	四縣	形容性狀	tai  sangˊ	大聲	loud	講話毋好恁大聲。	說話不要這麼大聲。
047	有用	初級	四縣	形容性狀	iuˊ iung	有用	useful	有用東西毋好擲忒。	有用的東西不要扔掉。
048	無用	初級	四縣	形容性狀	moˇ iung	沒用	unused; useless	阿姆喊同無用个盤仔收起來。	媽媽叫我把沒用的盤子收起來。
049	悲傷	初級	四縣	形容性狀	biˊ songˊ	悲傷	sad	厥倈仔出車禍，佢當（蓋）悲傷。	他兒子出車禍，他很悲傷。
050	安全	初級	四縣	形容性狀	onˊ qionˇ	安全	safe	坐吾个車仔當（蓋）安全，毋使愁。	坐我的車很安全，不必擔心。
051	共樣	初級	四縣	形容性狀	kiung  iong	一樣	same	吾个想法同你共樣。	我的想法和你一樣。
052	無共樣	初級	四縣	形容性狀	moˇ kiung  iong	不同	different	無共樣个東西，愛分開來放。	不一樣的東西，要分開來放。
053	無消無息	初級	四縣	形容性狀	moˇ seuˊmoˇ xidˋ	音訊全無	unaccounted for	厥姨走忒後，到今無消無息。	他阿姨離家後，到現在音訊全無。
054	聲	初級	四縣	形容性狀	sangˊ	聲音	sound	電視个聲毋好放忒大。	電視的聲音不要開這麼大。
055	外形	初級	四縣	形容性狀	ngoi hinˇ	形狀	shape; form	佢新起个屋仔，外形同人無共樣。	他新蓋的房子，外形和別人不一樣。
056	細	初級	四縣	形容性狀	se	小	small	老妹較（過）細，愛讓佢。	妹妹比較小，要讓他。
057	幼	初級	四縣	形容性狀	iu	細	fine; teeny	蔥仔毋好切恁幼。	蔥不要切這麼細。
058	鮮	初級	四縣	形容性狀	xienˊ	稀	thin; diluted; crystal-clear	這碗粥當（蓋）鮮。	這碗粥很稀。
059	闊	初級	四縣	形容性狀	fadˋ	寬	wide	這隻間房當（蓋）闊、當（蓋）大。	這個房間很寬、很大。
060	烏忒【烏核】	初級	四縣	形容性狀	vuˊtedˋ【vuˊhedˋ】	熄滅	（fire） be put out	火分風吹烏忒(烏核)。	火被風吹熄。
061	骯髒（垃圾）	初級	四縣	形容性狀	oˊ zoˊ（laˋ sabˋ）	骯髒	dirty	手骯髒，做毋得拿東西食。	手骯髒，不可以拿東西吃。
062	淨俐	初級	四縣	形容性狀	qiang  li	乾淨	clean	佢從細就當（蓋）愛淨俐。	他從小就很愛乾淨。
063	勻	初級	四縣	形容性狀	iunˇ	均勻	（to mix up） evenly	泡牛奶粉，愛搐分佢勻。	泡奶粉，要沖勻。
064	鬧熱	初級	四縣	形容性狀	nau  ngied 【nau  ngiad】	熱鬧	noisy and lively	今晡日市場當（蓋）鬧熱。	今天市場很熱鬧。
065	生份	初級	四縣	形容性狀	sangˊ fun	陌生	shy; strange	這隻細人仔毋驚生份。	這個小孩子不怕生。
066	高低	初級	四縣	形容性狀	goˊ daiˊ	高低	level	這兩篇文章當（蓋）難分出高低。	這兩篇文章很難分出高下。
067	低	初級	四縣	形容性狀	daiˊ	低	low	放較（過）低兜仔，正拿得着。	放低一點，我才拿得到。
068	平	初級	四縣	形容性狀	piangˇ	平	even	地泥無平，桌仔放毋會正。	地不平，桌子放不正。
069	直	初級	四縣	形容性狀	ciid	直	straight; vertical	這條大路當（蓋）直。	這條馬路很直。
070	橫	初級	四縣	形容性狀	vangˇ	橫	horizontal	這支棍仔忒長，打橫放較（過）好。	這根棍子太長，橫放比較好。
071	彎	初級	四縣	形容性狀	vanˊ	彎	bending; not straight	竹篙彎忒吔，去買過新个。	竹竿彎掉了，去買支新的。
072	賁	初級	四縣	形容性狀	punˊ	厚	thick	柚仔个皮當（蓋）賁，擘毋開。	柚子的皮很厚，我剝不開。
073	薄	初級	四縣	形容性狀	pog	薄	thin	這張紙當（蓋）薄，一扯就爛。	這張紙很薄，一撕就破。
074	遽	初級	四縣	形容性狀	giagˋ	快	quick	行恁遽做麼个？趕時間係無？	走這麼快幹什麼？趕時間是嗎？
075	慢	初級	四縣	形容性狀	man	緩慢	slow	你行路恁慢，無愛(毋愛)分你跈。	你走路這麼慢，不讓你跟。
076	難	初級	四縣	形容性狀	nanˇ	困難	difficult	考試題目當（蓋）難，當（蓋）多毋曉得寫。	考試題目很難，我很多不會寫。
077	冰	初級	四縣	形容性狀	benˊ	冰冷	ice	細人仔當（蓋）好食冰个東西。	小孩子很喜歡吃冰的東西。
078	酸	初級	四縣	形容性狀	sonˊ	酸	sour	酸梅當（蓋）酸，毋好食。	酸梅很酸，我不喜歡吃。
079	甜	初級	四縣	形容性狀	tiamˇ	甜	sweet	這西瓜無甜，毋好食。	這西瓜不甜，不好吃。
080	苦	初級	四縣	形容性狀	fuˋ	味道苦	bitter	試(測)着苦瓜當（蓋）苦。	我覺得苦瓜很苦。
081	辣	初級	四縣	形容性狀	lad	辣味	spicy; hot	當（蓋）好食辣。	我很喜歡吃辣。
082	飽	初級	四縣	形容性狀	bauˋ	飽	full	暗晡夜食忒飽，睡毋忒。	今天晚上吃得太飽，睡不著。
083	妥當	初級	四縣	形容性狀	toˇ dong 【toˋ dong】	妥當	appropriate	你恁樣(恁呢)做，妥當無？	你這樣做，妥當嗎？
084	一路里來	初級	四縣	形容性狀	idˋ lu liˊ loiˇ	向來如此	always	老弟一路里來都當（蓋）聽話。	弟弟一向都很聽話。
085	危險	初級	四縣	形容性狀	nguiˇ hiamˋ【munˇhiamˋ】	危險	dangerous	落大雨，行山路當（蓋）危險。	下大雨，走山路很危險。
086	熱心	初級	四縣	形容性狀	ngied  ximˊ【ngiad  ximˊ】	熱心	enthusiastic	佢當（蓋）熱心，選佢做班長盡好。	他很熱心，選他做班長最好。
087	推	初級	四縣	形容性狀	toiˊ	推卸	to shift （responsibility）	自家个事自家做，毋好推分人。	自己的事自己做，不要推給人。
088	事實	初級	四縣	形容性狀	sii  siid	事實	fact	這報導毋係事實。	這報導不是事實。
089	經驗	初級	四縣	形容性狀	ginˊ ngiam	經驗	experience	老妹無經驗，你愛教佢。	妹妹沒經驗，你要教她。
090	無閒	初級	四縣	形容性狀	moˇ hanˇ	沒空	busy	阿爸逐（每）日加班，當（蓋）無閒。	爸爸每天加班，很忙。
091	有閒	初級	四縣	形容性狀	iuˊ hanˇ	有空	free	有閒正來尞。	有空來玩。
092	無聊	初級	四縣	形容性狀	vuˇ liauˇ	無聊	boring, bored	無事做，感覺當（蓋）無聊。	沒事做，感覺很無聊。
093	見笑	初級	四縣	形容性狀	gien  seu 【gian seu】	不好意思	embarrassed; shameless	恁大人吔還愛人揇，毋知見笑！	這麼大了還要人抱，不害臊！
094	戇	初級	四縣	形容性狀	ngong	傻	stupid, foolish	你仰恁戇！買東西毋知好找錢！	你怎麼這麼傻！買東西不知道找錢！
095	靚【鬧】	初級	四縣	形容性狀	jiangˊ【nau】	漂亮	beautiful	這蕊花開到當（蓋）靚 (鬧)。	這朵花開得很漂亮 。
096	公當	初級	四縣	形容性狀	gungˊ dong	公平	just	你恁樣(呢)判 ，當（蓋）公當。	你這樣判 ，很公平。
097	老實	初級	四縣	形容性狀	loˋ siid	誠實	honest	阿明講話當（蓋）無老實，毋好相信佢。	阿明說話很不老實，不要相信他。
098	撮假	初級	四縣	形容性狀	codˋgaˋ	虛假	deceitful	佢做个東西當（蓋）撮假，當（蓋）多人嫌。	他做的東西很偷工減料，很多人嫌。
099	希望	初級	四縣	形容性狀	hiˊ mong	希望	hope; to hope	希望做得出國去尞。	我希望可以出國去玩。
100	失望	初級	四縣	形容性狀	siidˋ mong	失望	disappointed	佢無考着一百分 ，當（蓋）失望。	他沒考一百分 ，很失望。
101	幸福	初級	四縣	形容性狀	hen  fugˋ	幸福	fortunate	這下人當（蓋）幸福，愛麼个有麼个。	現在的人很幸福，要什麼有什麼。
102	幸運【運氣好】	初級	四縣	形容性狀	hen  iun【iun hi hoˋ】	幸運	lucky	公司做尾牙，佢著着大獎 ，非常幸運(運氣非常好)。	他尾牙中了大獎 ，很幸運。
103	神奇	初級	四縣	形容性狀	siinˇ kiˇ	神奇	magical	佢變个奇術當（蓋）神奇。	他變的魔術很神奇。
104	暢	初級	四縣	形容性狀	tiong	高興	happy	考試打頭名，暢到奈毋得。	我考試第一名，高興得不得了。
105	歡喜	初級	四縣	形容性狀	fonˊ hiˋ	歡喜	happy	佢選着班長，阿公當（蓋）歡喜。	他選上班長，爺爺很高興。
106	好	初級	四縣	形容性狀	hau	喜好；嗜好	be fond of; to love	阿爸當（蓋）好食水梨仔。	爸爸很喜歡吃水梨。
107	鬆爽	初級	四縣	形容性狀	sungˊ songˋ	舒適	comfortable	這間屋仔歇起來當（蓋）鬆爽。	這間房子住起來很舒適。
108	辛苦	初級	四縣	形容性狀	xinˊ kuˋ	辛苦	difficult	阿爸賺錢當（盡）辛苦。	爸爸賺錢很辛苦。
109	爽	初級	四縣	形容性狀	songˋ	痛快	to one's heart's content	該群細人仔搞到當（蓋）爽。	那群小孩子玩得很痛快。
110	著驚【嚇着】	初級	四縣	形容性狀	cog   giangˊ【hagˋdoˋ】	受驚嚇	surprised; scared	喊到恁大聲，害著驚(嚇着)一下。	叫得這麼大聲，害我嚇一跳。
111	鼓【刺着】	初級	四縣	形容性狀	guˋ【qiug doˋ】	針刺	to pierce	注射針吂鼓着(刺着)，佢就噭吔。	針頭還沒刺下去，他就哭了。
112	笑咪咪(微微)仔【笑咪咪(微微)吔】	初級	四縣	形容性狀	seu miˊmiˊeˋ【seu miˊ miˊ eˊ】	笑咪咪的	smile	佢看着人都笑咪咪仔，當（蓋）得人惜。	他見到人都笑瞇瞇的，很可愛。
001	燒暖	初級	四縣	天文地理	seuˊ nonˊ	暖和	warm	今晡日个天時當（盡）燒暖！	今天的天氣很暖和！
002	熱	初級	四縣	天文地理	ngied【ngiad】	熱	hot	今晡日還熱哪！	今天好熱啊！
003	涼	初級	四縣	天文地理	liongˇ	涼	cool	聽講天光日天時愛轉涼囉！	聽說明天天氣要轉涼囉！
004	寒【寒人】	初級	四縣	天文地理	honˇ【honˇ nginˇ】	寒冷	cold	今晡日當（蓋）寒(寒冷)，愛著加一領衫。	今天很冷，要多穿一件衣服。
005	冷	初級	四縣	天文地理	langˊ【(nangˊ)】	冷	cold	河壩水當(蓋)冷。	河水很冷。
006	烏陰	初級	四縣	天文地理	vuˊ imˊ	陰	cloudy	天烏陰烏陰，怕會落雨吔！	天氣陰陰，怕要下雨了！
007	燥	初級	四縣	天文地理	zauˊ	乾燥	dry	鹹菜晒燥變「鹹菜乾」。	酸菜晒乾變「梅干菜」。
008	溼	初級	四縣	天文地理	siibˋ	溼	wet	地泥恁溼，行路愛細義。	地上這麼溼，走路要小心。
009	風	初級	四縣	天文地理	fungˊ	風	wind	外背風當（蓋）大。	外面風很大。
010	雲	初級	四縣	天文地理	iunˇ	雲	cloud	天頂無半滴雲，還熱哦！	天上沒半點雲，好熱哦！
011	冰	初級	四縣	天文地理	benˊ	冰	ice	熱天時節，當(蓋)多人好食冰。	夏天時，很多人愛吃冰。
012	雪	初級	四縣	天文地理	xiedˋ	雪	snow	寒流來，合歡山落雪吔。	寒流來，合歡山下雪了。
013	風搓	初級	四縣	天文地理	fungˊ caiˊ	颱風	typhoon	今年風搓特別多。	今年颱風特別多。
014	好天	初級	四縣	天文地理	hoˋ tienˊ	晴天	clear day	今晡日恁好天，出來去尞。	今天天氣這麼好，出去玩。
015	烏陰天	初級	四縣	天文地理	vuˊ imˊ tienˊ	陰天	cloudy  day	烏陰天出門，還係帶遮仔較（過）好。	陰天出門，還是帶雨傘比較好。
016	涼爽	初級	四縣	天文地理	liongˇ songˋ	涼快	cool	在榕樹下尞較涼爽。	在榕樹下玩比較涼爽。
017	響雷公	初級	四縣	天文地理	hiongˋ luiˇ gungˊ	打雷	to thunder	當(蓋)驚響雷公。	我很怕打雷。
018	爧	初級	四縣	天文地理	ngiabˋ lang 【ngiabˋ nang】	閃電	to lightning	爧過後，跈等會響雷公。	閃電過後，接著會打雷。
019	落雨	初級	四縣	天文地理	log  iˋ	下雨	to rain	落雨囉！去學校愛擎遮仔。	下雨囉！上學要撐傘。
020	起濛紗煙【起濛露】【起濛霧】	初級	四縣	天文地理	hiˋ mungˇ saˊ ienˊ【hiˋ mungˇ lu】【hiˋmungˇvu】	起霧	to become foggy	朝晨頭起濛紗煙（起濛露），大體(概)會好天。	早上起霧，大多會天晴。
