序號	客家語言	等級	腔調	類別	客語音標	華語辭義	英語詞義	客語例句	華語翻譯
036	手錶仔（時錶仔）	初級	四縣	時間空間	suˋbeuˋeˇ（siiˇ beuˋeˇ）【suˋ beuˊ eˋ】	手錶	watch	無戴手錶仔，毋知這下幾多點。	我沒戴手錶，不知道現在幾點。
037	鬧鐘仔【鬧鐘】	初級	四縣	時間空間	nau  zungˊeˋ【nau  zungˊ】	鬧鐘	alarm clock	天光日愛早，愛記得撙(轉)鬧鐘仔(鬧鐘)喔！	明天要早起，要記得設定鬧鐘喔！
038	朝晨	初級	四縣	時間空間	zeuˊ siinˇ	早晨	morning	吾婆逐朝晨都去公園運動。	我奶奶每天早上都去公園運動。
039	當晝	初級	四縣	時間空間	dongˊ zu	中午	midday	當晝無睡，下晝當（蓋）無精神。	中午沒睡午覺，下午很沒精神。
040	下晝	初級	四縣	時間空間	haˊ zu	下午	afternoon	阿坤哥湊（邀）天光下晝去看電影。	阿坤哥約我明天下午去看電影。
041	臨暗仔（臨暗頭）	初級	四縣	時間空間	limˇ am eˋ（limˇ am  teuˇ）	傍晚	at dusk	臨暗仔正過來食夜。	傍晚再過來吃晚飯。
042	半夜	初級	四縣	時間空間	ban ia	半夜	midnight	昨哺日趕作業，半夜正睡。	我昨天趕作業，半夜才睡。
043	星光半夜【三更半夜】	初級	四縣	時間空間	sangˊ gongˊ ban  ia 【samˊ gongˊ ban  ia 】	三更半夜	small hours	佢逐(每)日都讀書讀到星光半夜【三更半夜】。	他每天都讀書讀到三更半夜。
044	天吂光	初級	四縣	時間空間	tienˊmangˇgongˊ	天未亮	before daylight	阿公長年天吂光就去洗身仔。	爺爺長年天還沒亮就去游泳。
045	臨天光仔（天曚光、天甫光）	初級	四縣	時間空間	limˇ tienˊgongˊeˋ（ tienˊ mungˇ gongˊ、tienˊ puˋgongˊ）	黎明	at dawn	臨天光仔，阿公就去做運動哩 。	黎明時，爺爺就去運動了 。
046	一天光（天一光）	初級	四縣	時間空間	idˋ tienˊ gongˊ（tienˊidˋgongˊ）	天一亮	at daybreak	阿爸一天光就床。	爸爸天一亮就起床。
047	一夜到天光（透夜）	初級	四縣	時間空間	idˋia do tienˊgongˊ（teu ia ）	通宵；透夜	all night long	昨暗晡睡毋忒，一夜到天光翻來翻去。	昨天晚上睡不著，整晚翻來覆去。
048	日期	初級	四縣	時間空間	ngidˋ kiˇ	日期	date	你結婚个日期定好勢吂？	你結婚的日期訂好了嗎？
049	期間	初級	四縣	時間空間	kiˇ gienˊ【kiˇgianˊ】	期間	period	考試个期間，阿爸不准兜(等)看電視。	考試期間，爸爸不准我們看電視。
050	前日	初級	四縣	時間空間	qienˇ ngidˋ	前天	day before yesterday	前日去動物園看貓熊。	前天我去動物園看貓熊。
051	昨晡日	初級	四縣	時間空間	coˊ  buˊ ngidˋ【coˊ  binˊ ngidˋ】	昨天	yesterday	昨晡日發風搓，毋使上班上課。	昨天刮颱風，不必上班上課。
052	今晡日	初級	四縣	時間空間	gimˊ buˊ ngidˋ/ginˊ buˊ ngidˋ【ginˊ binˊ ngidˋ】	今天	today	今晡日係吾个生日。	今天是我的生日。
053	天光日	初級	四縣	時間空間	tienˊ gongˊ ngidˋ【tiangˊ gongˊ ngidˋ】	明天	tomorrow	天光日學校愛開運動會。	明天學校要開運動會。
054	後日	初級	四縣	時間空間	heuˊ  ngidˋ	後天	day after tomorrow	後日學校愛舉行校外教學。𠊎	後天學校要舉行校外教學。𠊎
055	大後日	初級	四縣	時間空間	tai  heuˊ ngidˋ	大後天	three days later	大後日禮拜，（等）來去臺中尞好無？	大後天禮拜天，我們去臺中玩好嗎？
056	個半月（隻半月）	初級	四縣	時間空間	ge ban ngied （zagˋ ban  ngied ）【ge ban ngiad、zagˋ ban  ngiad 】	一個半月	a month and a half	吾爸去大陸出差個半月。	我爸爸去大陸出差一個半月。
057	幾下個月（幾下隻月）	初級	四縣	時間空間	giˋ haˊ ge  ngied （giˋ haˊzagˋngied ）【giˋ haˊ zagˋ ngiad 】	好幾個月	several months	佢出車禍，幾下個月無來學校。	他出車禍，幾個月沒來學校。
058	麼个時節	初級	四縣	時間空間	maˋ ge  siiˇ jiedˋ	什麼時候	when	你麼个時節有閒？	你什麼時候有空？
059	歸日	初級	四縣	時間空間	guiˊ ngidˋ	整天	all day long	佢歸日都在該讀書。	他整天都在讀書。
060	時節	初級	四縣	時間空間	siiˇ jiedˋ	時候	time	麼个時節吔，你還吂去，會赴毋着哩！	什麼時候了，你還沒去，要趕不上了！
061	頭擺【弄擺】	初級	四縣	時間空間	teuˇ baiˋ【nung baiˋ】	從前	before; in the past	頭擺人个生活當（蓋）艱苦。	以前人的生活很苦。
062	頭先	初級	四縣	時間空間	teuˇ xienˊ	剛才；最初	a moment ago	你頭先去哪位？	你剛才去哪裡？
063	下二擺	初級	四縣	時間空間	ha ngi baiˋ	以後；下一次	next time; later	這下做毋得，下二擺正講。	現在不行，以後再說。
064	現代	初級	四縣	時間空間	hien  toi 【hian  toi 】	現代	modern	現代醫學發達，壽命較（過）長。	現代醫學發達，壽命比較長。
065	黏時（ 黏皮）	初級	四縣	時間空間	ngiamˇsiiˇ（ngiamˇpiˇ）【liamˇsiiˇ、liamˇpiˇ】	馬上	at once	等一下，黏時好。	等我一下，我馬上好。
066	等下仔（等一下）	初級	四縣	時間空間	denˋha eˋ（denˋidˋha）	等一下	wait a minute	等一下！若東西毋記得拿吔！	等一下！你東西忘記拿了！
067	隨時	初級	四縣	時間空間	suiˇsiiˇ	隨時	immediately	一通電話，隨時過來。	一通電話，我隨時過來。
068	逐日【每日】	初級	四縣	時間空間	dagˋ ngidˋ【miˊ ngidˋ】	每天	every day	吾公逐（ 每）日朝晨愛去公園打拳。	我爺爺每天早上要去公園打拳。
069	日時頭	初級	四縣	時間空間	ngidˋ siiˇ teuˇ【ngidˋsiiˋteuˇ】	白天	daytime	暗晡頭係無睡飽，日時頭會啄目睡。	晚上如果沒睡飽，白天會打瞌睡。
070	暗晡頭	初級	四縣	時間空間	am  buˊ teuˇ	晚上	evening; nighttime	暗晡頭愛早睡，朝晨頭愛早。	晚上要早睡，早上要早起。
071	暗晡夜	初級	四縣	時間空間	am  buˊia	今天晚上	tonight; this evening	暗晡夜來去看電影好無？	今天晚上去看電影好嗎？
072	打早	初級	四縣	時間空間	daˋ zoˋ	一大早	early in the morning	頭擺人做事，打早出門，斷烏正轉（正歸）。	以前的人做事，一大早出門，天黑才回家。
073	七早八早	初級	四縣	時間空間	qidˋ zoˋ badˋ zoˋ	大清早	early in the morning	阿姆逐日七早八早就䟘起來運動(做事)。	媽媽每天大清早就起來運動(工作)。
074	臨晝仔【當晝邊】	初級	四縣	時間空間	limˇzu eˋ【dongˊ zu bienˊ】	晌午時分	not early and not late; at around 10 a.m. or at around 4 p.m.	阿爸出去吔，臨晝仔(當晝邊)正會轉(歸)來。	爸爸出門了，近中午才會回來。
075	日誌【日曆仔】	初級	四縣	時間空間	ngidˋ zii  【ngidˋ lag eˋ】	日曆	daily calendar	日誌（日曆仔）一日扯一頁。	日曆一天撕一頁。
076	月曆【(月曆仔)】	初級	四縣	時間空間	ngied  lag 【(ngiad lag eˋ)】	月曆	monthly calendar	這隻月曆个風景當（蓋）靚。	這個月曆的風景很漂亮。
077	舊曆（農曆）	初級	四縣	時間空間	kiu  lag （nungˇ  lag ）	農曆	lunar calendar	舊曆過年愛祭祖、拜天公。	農曆過年要祭祖、拜玉皇大帝。
078	新曆	初級	四縣	時間空間	xinˊ lag	新曆	solar calendar	今晡日係新曆七月十六。	今天是新曆七月十六日。
079	面前【頭前】	初級	四縣	時間空間	mien  qienˇ【teuˇ qienˇ】	前面	forward; in front of	阿雄坐在吾面前(頭前)。	阿雄坐在我前面。
080	後背	初級	四縣	時間空間	heu  boi	後面	behind; at the back	阿文伯个後背跈等一隻狗仔。	阿文伯的後面跟著一隻狗。
081	左片【左手片】	初級	四縣	時間空間	zoˋ pienˋ【zoˋ suˋ pienˋ】	左邊	left	學校个左片(左手片)有一間郵局。	學校的左邊有一家郵局。
082	右片【右手片】	初級	四縣	時間空間	iu  pienˋ【iu suˋ pienˋ】	右邊	right	超級商店个右片(右手片)係郵局。	超級商店的右邊是郵局。
083	中央	初級	四縣	時間空間	dungˊ ongˊ	中央	middle, center	運動坪中央有三、四粒球仔。	運動場中央有三、四粒球。
084	脣（脣項、邊脣）	初級	四縣	時間空間	sunˇ（sunˇ hong、bienˊ sunˇ）【siinˇ】	旁邊	beside	大路脣有一頭大榕樹。	大路旁有一棵大榕樹。
085	面頂【面項/頂項】	初級	四縣	時間空間	mien  dangˋ【mien hong/dangˋhong】	上面	above	紙箱面頂(面項)有一粒球仔。	紙箱上面有一粒球。
086	頂高	初級	四縣	時間空間	dangˋ goˊ	上方	over; above	電線頂高企等一隻阿啾箭。	電線上站著一隻烏鶖。
087	上背	初級	四縣	時間空間	song  boi	上面	up; north	今晡日上背叔婆做生日。	今天上家叔婆做生日。
088	下背	初級	四縣	時間空間	haˊ boi	下面	below; south	凳仔下背有一隻球仔。	凳子下面有一粒球。
089	裡背（裡肚）	初級	四縣	時間空間	diˊ  boi（diˊ duˋ）	裡面；當中	inside	便所裡背怕有人，吂落去愛先開聲。	怕廁所裡面有人，進去之前要先出聲。
090	外背	初級	四縣	時間空間	ngoi  boi （ngo boi 、no boi 、mo boi）【lo boi】	外面	outside	大門外背有一隻大狗牯。	大門外面有一隻大公狗。
091	之間	初級	四縣	時間空間	ziiˊ gienˊ【zii gianˊ】	之間	between	學校到車頭之間，有一公里零。	學校到車站之間，有一公里多。
092	上	初級	四縣	時間空間	song	上	up; top	上家下屋定著愛互相照顧。	左鄰右舍一定要互相照顧。
093	下	初級	四縣	時間空間	haˊ	下	down; bottom	落大雨，店亭下當(蓋)多人寄雨。	下大雨，走廊下很多人躲雨。
094	內	初級	四縣	時間空間	nui	內	inside	先生交代佢，三日內做毋得下眠床。	醫生交代他，三天內不可以下床。
095	外	初級	四縣	時間空間	ngoi	外	outside	屋外該群後生人係來尋你个無？	屋外那群年輕人是來找你的嗎？
096	斜	初級	四縣	時間空間	qiaˇ	斜	diagonal	學校斜對面有一間西藥店。	學校斜對面有一家西藥房。
097	側	初級	四縣	時間空間	zedˋ	側	side	屋側角有一頭牛眼樹。	屋側角落有一棵龍眼樹。
098	邊脣（脣邊）【脣口】	初級	四縣	時間空間	bienˊsunˇ（sunˇbienˊ）【siinˇ heuˋ】	旁邊	side	電火開關就在若邊脣（脣口）。	電燈開關就在你旁邊。
099	近	初級	四縣	時間空間	kiunˊ	近	near	吾屋下離學校當（蓋）近。	我家離學校很近。
100	遠	初級	四縣	時間空間	ienˋ【ianˋ】	遠	far	學校到車頭還當（蓋）遠。	學校到車站還很遠。
101	對中	初級	四縣	時間空間	dui ／di  dungˊ	正對著中間	facing the center	相片肚，後排企對中个係吾姆。	相片裡，後排站正中央的是我媽媽。
102	背尾	初級	四縣	時間空間	boi  miˊ【liamˋmiˊ】	後面；最後	at last	佢當（ 盡 ）高，企在盡背尾。	他很高，站在最後面。
103	適當	初級	四縣	時間空間	didˋ/siidˋ dongˊ	適當	appropriate	阿強當（蓋）熱心，選佢做班長盡適當。	阿強很熱心，選他做班長很適合。
104	東	初級	四縣	時間空間	dungˊ	東	east	日頭對東片出來。	太陽從東邊出來。
105	西	初級	四縣	時間空間	xiˊ	西	west	這隻間房向西，下晝頭當(蓋)熱。	這個房間西晒，下午很熱。
106	南	初級	四縣	時間空間	namˇ	南	south	天光日愛去南部出差。	我明天要去南部出差。
107	北	初級	四縣	時間空間	bedˋ	北	north	這條路向北直直行，就會到學校。	這條路向北直直走，就會到學校。
108	中	初級	四縣	時間空間	zungˊ	中	middle	吾姐婆（阿婆）歇在臺灣中部个南投縣。	我外婆住在臺灣中部的南投縣。
001	康健（健康）	初級	四縣	疾病醫療	kongˊkien （kien kongˊ）【kongˊ kian】【kian kongˊ】	健康	healthy	祝福你，身體康健，萬事如意！	祝福你，身體健康，萬事如意！
002	弱	初級	四縣	疾病醫療	ngiog	衰弱	weak	佢身體當（蓋）弱，動啊着就寒着、流鼻水。	他身體很弱，動不動就感冒、流鼻水。
003	睡目	初級	四縣	疾病醫療	soi  mugˋ	睡覺	sleep	作業做忒正做得去睡目。	作業做完才可以去睡覺。
004	反躁（失眠）【睡毋落覺】	初級	四縣	疾病醫療	fanˋ cau　（siidˋ minˇ）【soi mˇ log gau】	失眠	insomnia	昨暗晡反躁(睡毋落覺)，歸暗晡睡毋得。	昨天晚上失眠，整晚睡不著。
005	嘴燥【肚渴】	初級	四縣	疾病醫療	zoi  zauˊ【duˋhodˋ】	口渴	thirsty	嘴燥(肚渴)，想食茶。	我口渴，想喝茶。
006	發病仔【發病】	初級	四縣	疾病醫療	bodˋ piang eˋ【bodˋ piang】	生病	to get sick	發病仔【發病】愛乖乖食藥仔，正會較（過）遽好。	生病要乖乖吃藥，才會好得快。
007	死亡	初級	四縣	疾病醫療	xiˋ mongˇ	死亡	death	這擺大地動，該載無人死亡。	這次大地震，幸好沒人死亡。
008	過身	初級	四縣	疾病醫療	go  siinˊ	過世	to pass away	吾太食到一百歲正過身。	我曾祖父活到一百歲才過世。
009	砸【健】	初級	四縣	疾病醫療	zabˋ【kian】	強壯	strong	佢身體當（蓋）砸(健)，恁寒个天還著短袖衫。	他身體很壯，這麼冷的天氣還穿短袖衣。
010	（悿）	初級	四縣	疾病醫療	kioi （tiamˋ）	疲倦	tired	今晡日做當（蓋）多事，還哦！	今天做很多事，好累哦！
011	肚飢	初級	四縣	疾病醫療	duˋ giˊ	餓	hungry	朝晨食忒少，臨晝仔就肚飢吔。	我早上吃太少，近中午就肚子餓了。
012	頭暈腦疺	初級	四縣	疾病醫療	teuˇ hinˇ noˋ bienˋ	頭昏腦脹	lighteaded	這題數學算到頭暈腦疺。	這道數學算得我頭昏腦脹。
013	頭那痛	初級	四縣	疾病醫療	teuˇ naˇ tung	頭痛	headache	頭那痛，毋知係寒着無？	我頭痛，不知道是不是感冒？
014	胃痛	初級	四縣	疾病醫療	vi  tung	胃痛	stomachache	胃痛盡艱苦，愛遽遽(共快)去分先生看。	胃痛很難受，要趕快去看醫生。
015	牙齒痛	初級	四縣	疾病醫療	ngaˇ ciiˋ tung	牙痛	toothache	牙齒痛，愛去看牙科。	牙齒痛，要去看牙科。
016	流鼻水	初級	四縣	疾病醫療	liuˇ pi  suiˋ	流鼻水	to have a runny nose	佢緊流鼻水，怕係寒着吔！	他一直流鼻水，可能感冒了！
017	寒着（感冒）【凍着】	初級	四縣	疾病醫療	honˇ doˋ（gamˋ mo ）【dung doˋ】	感冒	to catch a cold	天時恁寒，著到恁少，敢毋驚寒着（凍着）？	天氣這麼冷，穿得這麼少，難道不怕感冒？
018	激激顫【緊惇、打情疑】	初級	四縣	疾病醫療	gid gid  zunˊ【ginˋzunˊ、daˋqin ngin】	直發抖	to shiver	下晝變天吔，害寒到激激顫【打情疑】。	下午變天了，害我冷得直發抖。
019	發燒	初級	四縣	疾病醫療	fadˋ seuˊ	發燒	to have a fever	寒着、發燒，想愛請假去分先生看。	我感冒、發燒，想要請假去看醫生。
020	發痧	初級	四縣	疾病醫療	bodˋ saˊ	中暑	heatstroke	佢發痧吔，煞煞(共快)扶到屋肚去。	他中暑了，趕快扶到屋內去。
021	熱着	初級	四縣	疾病醫療	ngied  doˋ【ngiad doˋ】	中暑	heatstroke	在恁烈个日頭下做事，仰會毋熱着？	在這麼大的太陽下做事，怎麼會不中暑？
022	熱痱仔	初級	四縣	疾病醫療	ngied  bi  eˋ【ngiad bi eˋ】	痱子	heat rash	嬰兒仔驚熱，當（蓋）會發熱痱仔。	嬰兒怕熱，很會長痱子。
023	打脈	初級	四縣	疾病醫療	daˋ magˋ	把脈	to take pulse	漢醫用打脈就知病人發麼个病。	中醫把脈就知道病人生什麼病。
024	心臟病	初級	四縣	疾病醫療	ximˊ cong  piang	心臟病	heart disease	有心臟病个人，毋好食忒鹹。	有心臟病的人，不要吃太鹹。
025	肝病	初級	四縣	疾病醫療	gonˊ piang	肝病	liver trouble	生活無正常，又長在食忒多酒，較(過)會著着肝病。	生活不正常，又常常喝太多酒，比較容易得肝病。
026	風溼痛	初級	四縣	疾病醫療	fungˊsiibˋtung	風溼痛	rheumatism	天時一變，風溼痛就會擎起來。	天氣一變，風溼痛就會犯起來。
027	愛滋病	初級	四縣	疾病醫療	oi  ziiˊ piang	愛滋病	AIDS	著着愛滋病，做得食藥仔，毋過無法度斷根。	染上愛滋病，可以吃藥，不過沒辦法斷根。
028	洗腰仔	初級	四縣	疾病醫療	seˋ ieuˊ eˋ	洗腎	dialysis	佢逐禮拜愛去醫院洗腰仔。	他每個禮拜要去醫院洗腎。
029	高血壓	初級	四縣	疾病醫療	goˊ hiedˋ abˋ【goˊ haid abˋ】	高血壓	high blood pressure	高血壓个人，愛長期食藥仔。	高血壓的人，要長期吃藥。
030	糖尿病	初級	四縣	疾病醫療	tongˇ ngiau  piang	糖尿病	diabetes	阿公有糖尿病，做毋得食忒甜。	爺爺有糖尿病，不可以吃太甜。
031	發癌	初級	四縣	疾病醫療	bodˋ ngamˇ	得癌症	to have cancer	生活正常，多食青菜水果，較(過)毋會發癌。	生活正常，多吃青菜水果，比較不會得癌症。
032	近視	初級	四縣	疾病醫療	kiun  sii	近視	shortsighted	看毋着粉牌个字，怕係有近視吔。	我看不到黑板的字，大概是近視了。
033	老花眼	初級	四縣	疾病醫療	loˋ faˊ ngienˋ【loˋ faˊ ngianˋ】	老花眼	presbyopia	阿公有老花眼，無戴目鏡，無法度看報紙。	爺爺老花眼，沒戴眼鏡，沒辦法看報紙。
034	腦筋	初級	四縣	疾病醫療	biag  noˋ ginˊ	腦溢血	celebral hemorrhage	佢譴到腦筋。	他氣得腦溢血。
035	小兒麻痺	初級	四縣	疾病醫療	seuˋ iˇ maˇ bi	小兒麻痺	poliomyelitis	阿祥牯還細時節著着小兒麻痺。	阿祥小的時候染上小兒麻痺。
036	癢	初級	四縣	疾病醫療	iongˊ	癢	itchy	有兜人食着蝦公歸身仔會癢。	有些人吃到蝦全身會癢。
037	照光線（照電光）	初級	四縣	疾病醫療	zeu gongˊ xien （zeu tien  gongˊ）	照X光	to take an X ray	有身項个人，做毋得照光線。	有身孕的人，不可以照X光。
038	屙痢肚（屙瀉巴）	初級	四縣	疾病醫療	oˊ li  duˋ（oˊ xia  baˇ）	拉肚子	to have loose bowels	佢食着毋淨俐个東西，透（歸）日(仔)屙痢肚（屙瀉巴）。	他吃到不乾淨的東西，整天拉肚子。
039	出痲仔	初級	四縣	疾病醫療	cudˋ maˇ eˋ	出痲疹	to get the measles	出痲仔个人毋好去公共場所。	出痲疹的人不要到公共場所。
040	結舌	初級	四縣	疾病醫療	giedˋ sad【giadˋ sad】	口吃	to stutter	阿火頭一緊張就會結舌。	阿火一緊張就會口吃。
041	發癲	初級	四縣	疾病醫療	bodˋ dienˊ	發瘋	to go crazy	佢譴到強強會發癲吔。	他氣得幾乎要發瘋了。
001	來	初級	四縣	動作	loiˇ	來	to come	你天光日愛來無？	你明天要來嗎？
002	去	初級	四縣	動作	hi	去	to go	落雨天去哪都毋方便。	下雨天去哪裡都不方便。
003	上	初級	四縣	動作	songˊ	上	to ascend	腳無力儕(个人)，上梯排異（盡）辛苦。	腳無力的人，上樓梯很辛苦。
004	下	初級	四縣	動作	haˊ	下	to descend	老人家下梯排愛較（過）慢兜仔。	老人家下樓梯要慢一點。
005	問	初級	四縣	動作	mun	問	to ask	今晡日上數學課，先生問當（蓋）多問題。	今天上數學課，老師問很多問題。
006	答	初級	四縣	動作	dabˋ	答	to reply	這隻題目當(蓋)難，答毋出來。	這個題目很難，我答不出來。
007	聽	初級	四縣	動作	tangˊ	聽	to listen	細人仔盡好聽人講古。	小孩子最喜歡聽人講故事。
008	看	初級	四縣	動作	kon	看；探望	to see; to visit	阿明入院，大家去醫院看佢。	阿明住院，大家去醫院看他。
009	笑	初級	四縣	動作	seu	笑	to laugh	佢着一公一嫲个鞋來學校，好笑無？	他穿一公一母的鞋來學校，好不好笑？
010		初級	四縣	動作	nagˋ	大笑	to laugh	大家到腸仔都打結吔。	大家笑得腸子都打結了。
011	叫	初級	四縣	動作	gieu	鳥蟬鳴叫聲	to chirp; to buzz	公園肚滿（一）哪仔都聽吔着蟬仔叫。	公園裡到處都聽得到蟬叫。
012	噭	初級	四縣	動作	gieu	人哭	to cry	嬰兒仔噭吔，想愛食乳吔。	嬰兒哭了，要吃奶了。
013	罵	初級	四縣	動作	ma	罵	to scold; to abuse	吾頭家性體當（蓋）壞，動啊着就罵人。	我們老闆脾氣很壞，動不動就罵人。
014	喊	初級	四縣	動作	hemˊ/ ham	喊叫	to call	阿姆喊去買豆油。	媽媽叫我去買醬油。
015	講笑【講】	初級	四縣	動作	gongˋ seu 【gongˋ nagˋ】	開玩笑	to joke	摎（同）你講笑个(講)啦！	我跟你開玩笑的啦！
016	講話	初級	四縣	動作	gongˋ fa	說話	to speak; to talk	大人講話，細人仔毋好插嘴。	大人講話，小孩子不要插嘴。
017	投	初級	四縣	動作	teuˇ	告狀	to complain to	你係再過罵，就愛去投阿爸喔！	你如果再罵，我就要向爸爸告狀喔！
018	咬	初級	四縣	動作	ngauˊ	咬	to bite	該條狗仔當(蓋)惡，會咬人。	那條狗很兇，會咬人。
019	跪	初級	四縣	動作	kuiˋ	跪下	to kneel	阿明跪在地泥下搞泥沙。	阿明跪在地上玩泥沙。
020	踢	初級	四縣	動作	tedˋ	踢	to kick	細人仔睡目當（蓋）會踢被。	小孩子睡覺很會踢被。
021	敲	初級	四縣	動作	kau	敲	to knock	落人間房，愛先敲門。	進別人房間，要先敲門。
022	坐	初級	四縣	動作	coˊ	坐	to sit	阿婆坐在門口晒日頭。	奶奶坐在門口晒太陽。
023	摸	初級	四縣	動作	miaˊ/moˊ【mioˊ】	摸	to touch	阿爸摸吾頭那，阿當（蓋）乖！	爸爸摸我頭，稱讚我很乖！
024	拿	初級	四縣	動作	naˊ	拿	to take	若手項拿等麼个東西？	你手上拿著什麼東西？
025	用	初級	四縣	動作	iung	用	to use	用原子筆寫字當（蓋）滑溜。	用原子筆寫字很滑順。
026	放	初級	四縣	動作	biong	放置	to place	同報紙放在阿爸个書桌項。	我把報紙放在爸爸的書桌上。
027	畫	初級	四縣	動作	fa（vag）	繪畫	to draw; to paint	張先生畫一張圖送分。	張先生畫一張圖送給我。
028	捽	初級	四縣	動作	cud	擦拭	to wipe	用鉛筆寫字，寫毋著做得捽忒寫過。	用鉛筆寫字，寫錯可以擦掉重新寫過。
029	弇	初級	四縣	動作	giemˇ	覆蓋	to cover	請同鑊蓋弇起來。	請把鍋蓋蓋起來。
030	洗	初級	四縣	動作	seˋ	洗	to wash	食飽夜，會手洗碗筷。	吃過晚飯，我會幫忙洗碗筷。
031	搓	初級	四縣	動作	co	刷；搓	to brush; scrub ; rub	洗運動鞋，愛用搓仔搓，正會淨。	洗運動鞋，要用刷子刷，才會乾淨。
032	開	初級	四縣	動作	koiˊ	開	to open	有人撳門鈴，遽啊去開門。	有人按門鈴，快去開門。
033	關	初級	四縣	動作	guanˊ	關	to close	最背尾離開个人，愛關電火。	最後離開的人，要關電燈。
034	拉	初級	四縣	動作	laiˊ	拉	to pull	大索當（蓋）生趣，拉過來，你拉過去。	拔河很有趣，我拉過來，你拉過去。
035		初級	四縣	動作	bangˊ	拔	to drag	細人仔盡驚挷牙齒。	小孩子很怕拔牙齒。
036	企	初級	四縣	動作	kiˊ	站著	to stand	阿婆企在門口等轉（歸來）。	奶奶站在門口等我回家。
037	跍	初級	四縣	動作	guˊ	蹲	to squat	老弟跍等在䌈鞋帶仔。	小弟蹲著在綁鞋帶。
038	爬	初級	四縣	動作	paˇ	爬行	to crawl	嬰兒仔七坐八爬九生牙。	嬰兒七坐八爬九長牙。
039	走	初級	四縣	動作	zeuˋ	跑	to run	莫走恁遽，會跌倒。	別跑這麼快，會跌倒。
040	逐	初級	四縣	動作	giugˋ	追	to chase	你走恁遽，仰逐得着？	你跑這麼快，我怎麼追得上？
041	跟	初級	四縣	動作	gienˊ	跟隨	to follow	跟等來 ，正毋會跌忒(核)。	跟著來，才不會走丟。
042	跈	初級	四縣	動作	tenˇ	跟隨	to follow	佢跈厥爸去日本尞。	他跟爸爸去日本玩。
043	跳	初級	四縣	動作	tiau/tiauˇ	跳	to jump	細人仔毋好在膨凳頂跳。	小孩子不要在沙發上跳。
044	騎	初級	四縣	動作	kiˇ	騎	to ride	阿清哥逐日騎自行車上班。	阿清哥每天騎自行車上班。
045	飆	初級	四縣	動作	beuˊ	躍起	to gallop;to skyrocket	天時一下變，厥血壓就會飆起來。	天氣一變，他的血壓就會飆起來。
046	飛	初級	四縣	動作	biˊ	飛翔	to fly	花園肚(裡背)當（蓋）多揚蝶仔飛來飛去。	花園裡很多蝴蝶飛來飛去。
047	踏	初級	四縣	動作	tab	踏	to step	較細義兜仔，毋好踏着牛屎。	小心點，不要踩到牛屎。
048	捉	初級	四縣	動作	zogˋ	抓	to catch	大家來搞「官兵捉強盜」。	大家來玩「官兵捉強盜」。
049	尋	初級	四縣	動作	qimˇ	尋找	to search for	你囥（庰）到哪去？大家尋你毋着。	你躲到哪裡去？大家都找不到你。
050	扯	初級	四縣	動作	caˋ	撕	to rip/tear up	日誌（日曆仔）吊壁頂，一日扯一張。	日曆掛牆壁，一天撕一張。
051	啜【唶】	初級	四縣	動作	codˋ【jiod】	啜飲	to suck, to sip	食燒粥愛用啜(唶)，知無？	吃熱粥要用吸啜的方式，知道嗎？
