序號	客家語言	等級	腔調	類別	客語音標	華語辭義	英語詞義	客語例句	華語翻譯
033	針線	初級	四縣	服飾美容	ziimˊ xien	針線	needle and thread	去拿針線來分攣衫好無？	去拿針線讓我縫補衣服好嗎？
034	鞋	初級	四縣	服飾美容	haiˇ	鞋子	shoes	蹶山愛著鞋，較(過)毋會著傷。	爬山要穿鞋子，比較不會受傷。
035	皮鞋	初級	四縣	服飾美容	piˇ  haiˇ	皮鞋	leather shoes	去食酒，著皮鞋較（過）正式。	去喝喜酒，穿皮鞋比較正式。
036	高鞋	初級	四縣	服飾美容	goˊ zangˊ haiˇ【goˊ dangˊ haiˇ】	高跟鞋	high heels	有兜細妹仔好著高鞋。	有些女人喜歡穿高跟鞋。
037	靴仔	初級	四縣	服飾美容	hioˊ eˋ	靴子	leather shoes	佢同靴仔捽到金金。	他把靴子擦得亮晶晶。
038	水靴筒	初級	四縣	服飾美容	suiˋ hioˊ tungˇ	雨鞋	rain boots	落雨天，著水靴筒較（過）利便。	下雨天，穿雨鞋比較方便。
039	靴筒	初級	四縣	服飾美容	hioˊ tungˇ	長筒靴	high leather boots	吾這雙新靴筒係阿姆買个。	我這雙新長筒靴是媽媽買的。
040	短靴筒	初級	四縣	服飾美容	donˋ hioˊ tungˇ	短筒靴	short boots	這下當（蓋）時行著短靴筒。	現在很流行穿短筒靴。
041	球鞋	初級	四縣	服飾美容	kiuˇ haiˇ	球鞋	sports shoes	打球仔時節，愛著球鞋。	打球的時候，要穿球鞋。
042	布鞋	初級	四縣	服飾美容	bu  haiˇ	布鞋	cloth shoes	散步个時節，著布鞋較（過）輕鬆。	散步的時候，穿布鞋比較輕鬆。
043	拖鞋	初級	四縣	服飾美容	toˊ haiˇ	拖鞋	slippers	轉（歸）到屋下，愛先換拖鞋。	回到家，要先換拖鞋。
044	涼鞋	初級	四縣	服飾美容	liongˇ haiˇ	涼鞋	sandals	熱天著涼鞋，較（過）涼爽。	夏天穿涼鞋，比較涼爽。
045	襪仔	初級	四縣	服飾美容	madˋ eˇ【madˋ eˋ】	襪子	socks	著皮鞋無著襪仔，當（蓋）毋鬆爽。	穿皮鞋沒穿襪子，很不舒服。
046	著	初級	四縣	服飾美容	zogˋ	穿	to wear（clothes）	阿姆著新買个花裙去食酒。	媽媽穿新買的花裙去喝喜酒。
047	戴	初級	四縣	服飾美容	dai	戴	to wear（watches,hats...）	先生吩咐打籃球毋好戴時錶仔。	老師交代打籃球不要戴手錶。
001	城市	初級	四縣	居處	sangˇ sii	城市	city	城市个高樓比莊下較（過）多。	城市的高樓比鄉下多。
002	莊下	初級	四縣	居處	zongˊ  ha	鄉下	countryside	老人家歇莊下較（過）慣。	老人家住鄉下比較習慣。
003	別莊	初級	四縣	居處	pied  zongˊ（ped   zongˊ）	別墅	mansion	厥爸在竹北起一間別莊。	他爸爸在竹北蓋一間別墅。
004	區	初級	四縣	居處	kiˊ	區	district	厥屋下在臺北市仁愛區。	他家在臺北市仁愛區。
005	街	初級	四縣	居處	gieˊ(giaiˊ)	街	street	去通化街，愛仰般(仔)行？	去通化街，要怎麼走？
006	路	初級	四縣	居處	lu	路	road	臺北101大樓在信義路。	臺北101大樓在信義路。
007	巷	初級	四縣	居處	hong	巷	lane	歇在仁愛路三巷五號。	我住在仁愛路三巷五號。
008	弄	初級	四縣	居處	nung	弄	alley	這條路有巷無弄。	這條路有巷沒弄。
009	鄰	初級	四縣	居處	linˇ	鄰	neighborhood	你歇在第幾鄰？	你住在第幾鄰？
010	號	初級	四縣	居處	ho	號	number	若屋下門牌係幾多號？	你家門牌是幾號？
011	樓	初級	四縣	居處	leuˇ	樓	floor	吾辦公室在八樓。	我的辦公室在八樓。
012	廳下	初級	四縣	居處	tangˊ haˊ	廳堂/客廳	living room	老弟在廳下看電視。	弟弟在客廳看電視。
013	書房	初級	四縣	居處	suˊfongˇ	書房	study	在書房寫字。	我在書房寫字。
014	食飯間	初級	四縣	居處	siid  fan  gienˊ【siid fan gianˊ】	飯廳	dining room	厥屋下个食飯間當（蓋）闊。	他家的飯廳很寬。
015	灶下	初級	四縣	居處	zo  haˊ	廚房	kitchen	阿哥在灶下洗碗筷。	哥哥在廚房洗碗筷。
016	火灰【灰】	初級	四縣	居處	foˋfoiˊ【foiˊ】	灰燼	ashes	佢燒到變火灰，乜認得出來。	他燒成灰，我也認得出來。
017	間房【房間】	初級	四縣	居處	gienˊ fongˇ【fongˇ gianˊ 】	房間	bedroom	厥屋下有三隻間房(房間)。	他家有三個房間。
018	便所	初級	四縣	居處	pien  soˋ	廁所	lavatory; bathroom	請問便所在哪位？	請問廁所在哪裡？
019	屎缸	初級	四縣	居處	siiˋ gongˊ	茅坑	crapper	這下个屋，無人用屎缸吔。	現在的房子，沒人用茅坑了。
020	浴堂（洗身間）	初級	四縣	居處	iog tongˇ(seˋ siinˊ gienˊ)	浴室	bathroom	浴堂个地泥當（蓋）滑，落(入)去愛細義兜仔。	浴室的地板很滑，進去要小心一點。
021	花園	初級	四縣	居處	faˊ ienˇ【faˊianˇ】	花園	garden	厥屋下个花園，種當（蓋）多花。	他家的花園，種很多花。
022	禾埕	初級	四縣	居處	voˇ tangˇ	晒穀場、院子	rice-drying ground;yard	一群細人仔在禾埕搞。	一群小孩子在院子玩。
023	屋仔	初級	四縣	居處	vugˋ eˇ【vugˋ eˋ】	房子	house	厥公个屋仔在山項，空氣當（蓋）好。	他爺爺的房子在山上，空氣很好。
024	屋下	初級	四縣	居處	vugˋkaˊ【lugˋkaˊ】	家裏	home	厥屋下到今還無安冷氣。	他家至今還沒裝冷氣。
025	屋頂	初級	四縣	居處	vugˋ dangˋ	屋頂	roof	佢蹶上屋頂去安天線。	他爬上屋頂去裝天線。
026	地板	初級	四縣	居處	ti  banˋ	地板	floor	厥屋下个地板舖大理石。	他家的地板舖大理石。
027	屋簷下	初級	四縣	居處	vugˋ iamˇ haˊ	屋簷下	under the eaves	屋簷下有燕仔做竇。	屋簷下有燕子築巢。
028	門檻【（戶檻）】	初級	四縣	居處	munˇ kiamˊ【（fuˇ kiamˇ）】	門檻	threshold	去人屋下，毋好踏人个門檻（戶檻）。	去別人家，不要踩人家的門檻。
029	梯仔	初級	四縣	居處	toiˊ eˋ	梯子	ladder	阿哥喊同梯仔扶好勢，佢愛上屋頂。	哥哥叫我把梯子扶好，他要上屋頂。
030	梯排	初級	四縣	居處	toiˊpaiˇ	樓梯	stairway	上二樓，行梯排毋使等電梯。	上二樓，走樓梯不用等電梯。
031	電梯	初級	四縣	居處	tien toiˊ	電梯	elevator	地動个時節，毋好坐電梯。	地震的時候，不要坐電梯。
032	碫仔	初級	四縣	居處	don  eˋ	臺階	step	頭前有碫仔，愛細義行。	前面有臺階，要小心走。
033	圍牆	初級	四縣	居處	viˇ qiongˇ【viˇ xiongˇ】	圍牆	fence	出入學校，做毋得翻圍牆。	出入學校，不可以翻圍牆。
034	壁	初級	四縣	居處	biagˋ	牆壁	wall	壁頂吊个相片係麼人？	牆壁上掛的相片是誰？
035	窗門【窗仔】	初級	四縣	居處	cungˊmunˇ【cungˊeˋ】	窗	window	窗門打開來較（過）涼。	窗戶打開比較涼。
036	鐵窗仔	初級	四縣	居處	tiedˋ cungˊeˋ	鐵窗	window with iron grating	臺灣个屋仔，當（蓋）多安鐵窗仔。	臺灣的房子，很多人裝鐵窗。
037	門	初級	四縣	居處	munˇ	門	door	阿明厥屋下門開開，毋過無人在。	阿明他家門戶洞開，不過沒人在家。
038	鐵門	初級	四縣	居處	tiedˋ munˇ	鐵門	grille;iron gate	安鐵門，感覺較（過）安全。	裝鐵門，感覺比較安全。
039	鎖匙	初級	四縣	居處	soˋ siiˋ	鑰匙	key	毋記得帶鎖匙，屋嗄落(入)毋得。	我忘記帶鑰匙，結果無法進門。
040	鎖頭	初級	四縣	居處	soˋ teuˇ【soˋ siiˇ】	鎖頭	lock	用號碼个鎖頭較（過）方便，毋使帶鎖匙。	用號碼鎖頭比較方便，不必帶鑰匙。
041	電腦	初級	四縣	居處	tien  noˋ	電腦	computer	電腦代人做當（蓋）多事。	電腦替人做很多事。
042	筆記型電腦	初級	四縣	居處	bidˋ gi   hinˇ tien  noˋ	筆記型電腦	notebook （computer）	這下个筆記型電腦，緊做緊輕。	現在的筆記型電腦，越做越輕。
043	印表機	初級	四縣	居處	in  beuˋ giˊ	列表機	printer	新型个印表機，做得印相片。	新型的列表機，可以列印相片。
044	傳真機	初級	四縣	居處	conˇ ziinˊ giˊ	傳真機	fax machine	你同資料用傳真機傳分好無？	你把資料用傳真機傳給我好嗎？
045	翕相機	初級	四縣	居處	hibˋ xiong  giˊ	照相機	camera	這下个手機(仔)做得準翕相機來用。	現在的手機可以當相機用。
046	攝影機	初級	四縣	居處	ngiabˋ iangˋ giˊ	攝影機	video camera	電視公司用个攝影機當（蓋）貴。	電視公司用的攝影機很貴。
047	電視	初級	四縣	居處	tien  sii	電視	television	電視看吔恁久，好去寫字吔！	電視看了這麼久，該去寫功課了！
048	音響	初級	四縣	居處	imˊ hiongˋ	音響	stereo system	這種音響當(蓋)好，毋過無便宜。	這種音響很好，不過不便宜。
049	收音機	初級	四縣	居處	suˊimˊgiˊ	收音機	radio	吾爸駛車仔該下，會聽收音機。	我爸爸開車的時候，會聽收音機。
050	電話	初級	四縣	居處	tien  fa	電話	telephone	打電話同先生拜年。	我打電話向老師拜年。
051	手機仔	初級	四縣	居處	suˋgiˊeˋ	手機	mobile phone	打手機仔分阿哥，佢無接。	我打手機給哥哥，他沒接。
052	冷氣	初級	四縣	居處	langˊ hi【(nangˊhi)】	冷氣機	air conditioner	這下無安冷氣个人家當(蓋)少吔。	現在沒裝冷氣的人家很少了。
053	熱水器	初級	四縣	居處	ngied  suiˋ hi	熱水器	hot-water heater	熱水器愛安在屋外背正安全。	熱水器要裝在屋外才安全。
054	瓦斯爐	初級	四縣	居處	ngaˋ siiˊ luˇ	瓦斯爐	gas stove	用瓦斯爐煮食，當（蓋 ） 利便。	用瓦斯爐煮食，很方便。
055	洗衫機	初級	四縣	居處	seˋ samˊ giˊ	洗衣機	washing machine	用洗衫機洗衫，當（盡）省事。	用洗衣機洗衣，很省事。
056	焙衫機【烘衫機】	初級	四縣	居處	poi  samˊ giˊ【hangˊ samˊ giˊ】	烘衣機	clothes dryer	有焙衫機(烘衫機)，落雨天就毋使愁。	有烘衣機，下雨天就不用愁。
057	吹風機	初級	四縣	居處	coiˊ fungˊ giˊ	吹風機	hair dryer	頭那洗好，愛用吹風機吹燥。	頭洗好，要用吹風機吹乾。
058	瓦斯	初級	四縣	居處	ngaˋ siiˊ【ga siiˋ】	瓦斯	gas	出門之前愛記得關瓦斯。	出門之前要記得關瓦斯。
059	水道水	初級	四縣	居處	suiˋ to  suiˋ	自來水	tap water	臺灣連莊下都有水道水好用。	臺灣連鄉下都有自來水可用。
060	日光燈	初級	四縣	居處	ngidˋ gongˊ denˊ	日光燈	fluorescent lamp	點日光燈較（過）省電。	點日光燈比較省電。
061	電球仔【鴨胲仔】	初級	四縣	居處	tien  kiuˇ eˋ【abˋ goiˊ eˋ】	電燈泡	bulb	電球仔（鴨胲仔）壞忒（核）吔，去買隻新个來換。	電燈泡壞了，去買個新的來換。
062	電火	初級	四縣	居處	tien  foˋ	電燈	electric light or lamp	電火關忒佢，好去睡目吔！	把燈關掉，該去睡覺了！
063	眠床	初級	四縣	居處	minˇ congˇ	床鋪	bed	係想睡，就去眠床睡。	如果想睡，就去床上睡。
064	膨床（北多）	初級	四縣	居處	pong  congˇ（bed  doˋ）	彈簧床	spring bed	當（蓋）多老人家睡毋慣膨床。	很多老人家睡不慣彈簧床。
065	眠帳	初級	四縣	居處	minˇ  zong	蚊帳	mosquito net	蚊仔恁多，無吊眠帳睡毋得。	蚊子這麼多，沒掛蚊帳睡不著。
066	門簾	初級	四縣	居處	munˇ  liamˇ	門簾	door curtain	門簾放下來，正毋會分人看現現。	門簾放下來，才不會讓人一覽無遺。
067	簞笥	初級	四縣	居處	tan  siiˋ	衣櫥	wardrobe	簞笥大，做得吊較（過）多衫褲。	衣櫥大，可以掛比較多衣服。
068	被	初級	四縣	居處	piˊ	棉被	bed quilt	睡目愛蓋被，正毋會寒着。	睡覺要蓋棉被，才不會感冒。
069	枕頭	初級	四縣	居處	ziimˋ teuˇ	枕頭	pillow	有兜人睡目毋墊枕頭。	有些人睡覺不墊枕頭。
070	凳仔	初級	四縣	居處	den  eˋ	凳子	chair	阿良牯！去兜張凳仔來分人客坐好無？	阿良！去搬張凳子來讓客人坐好嗎？
071	膨凳	初級	四縣	居處	pong  den	沙發	sofa	阿文犁在膨凳項看電視。	阿文躺在沙發上看電視。
072	桌仔	初級	四縣	居處	zogˋ eˇ【zogˋeˋ】	桌子	table	教室肚个桌仔排到當(蓋)正。	教室裡的桌子排得很整齊。
073	馬桶	初級	四縣	居處	maˊ tungˋ	馬桶	toilet	吾屋下換過一隻新个馬桶。	我家換過一個新的馬桶。
074	鏡仔	初級	四縣	居處	giang  eˋ	鏡子	mirror	當（蓋）好照鏡仔。	我很喜歡照鏡子。
075	面盆	初級	四縣	居處	mien  punˇ	臉盆	washing basin	面盆肚个水冷忒吔，去換過一盆來！	臉盆裡的水冷掉了，去換過一盆！
076	面帕	初級	四縣	居處	mien pa	毛巾	towel	洗面以後，面帕愛洗淨，晾起來。	洗臉以後，毛巾要洗乾淨，晾起來。
077	牙确仔	初級	四縣	居處	ngaˇgog  eˋ	漱口杯	mouth washing cup	用牙确仔張水洗嘴。	我用漱口杯裝水刷牙漱口。
078	牙膏	初級	四縣	居處	ngaˇ gauˊ	牙膏	toothpaste	搓牙齒會用着牙膏。	刷牙會用到牙膏。
079	牙搓仔	初級	四縣	居處	ngaˇ co  eˋ	牙刷	toothbrush	出國旅行愛記得帶牙搓仔。	出國旅行要記得帶牙刷。
080	茶箍【番鹼】	初級	四縣	居處	caˇ guˊ【fanˊ gienˋ/gianˋ】	肥皂	soap	吾屋下人較（過）慣用茶箍（番鹼）洗衫。	我家裡人比較習慣用肥皂洗衣服。
081	衛生紙	初級	四縣	居處	vi  senˊ ziiˋ	衛生紙	toilet paper	衛生紙有帶着無？	衛生紙帶了嗎？
082	紅毛泥	初級	四縣	居處	fungˇ moˊ naiˇ	水泥	cement	紅毛泥還吂燥，還做毋得踏。	水泥還沒乾，還不可以踩。
083	信袋仔（信絡仔）	初級	四縣	居處	xin  toi  eˋ（xin  log  eˋ）	信封	envelope	愛寄信仔，毋過尋無半隻信袋仔（信絡仔）！	我要寄信，不過找不到半個信封！
084	稅屋仔（屋仔、租屋仔）	初級	四縣	居處	soi  vugˋeˇ（piog  vugˋeˇ、zuˊvugˋeˇ）	租房子	to rent a house	阿樹哥在外背稅屋仔歇。	阿樹哥在外面租房子住。
001	行	初級	四縣	交通	hangˇ	走；交往	to walk；to associate oneself with	頭前行等過來个，係吾哥。	前面走過來的人，是我哥哥。
002	飛行機	初級	四縣	交通	biˊ hangˇ giˊ（fiˊ hangˇ giˊ）【biˊ/fiˊ iangˇ giˊ】	飛機	airplane	臺北到日本，坐飛行機，愛三點鐘久。	臺北到日本，搭飛機，要三個鐘頭。
003	輪船（火船）	初級	四縣	交通	lunˇ  sonˇ（ foˋsonˇ ）	輪船	ship	有人毋敢坐飛行機，甘願坐輪船。	有人不敢搭飛機，情願搭輪船。
004	火車	初級	四縣	交通	foˋ caˊ	火車	train	講着愛坐火車，當（蓋）歡喜。	說到要坐火車，我很高興。
005	火車【火車頭】	初級	四縣	交通	foˋ caˊ maˇ【foˋ caˊ teuˇ】	火車頭	locomotive engine	頭擺个火車嫲（頭）燒石炭。	以前的火車頭燒煤炭。
006	遊覽車	初級	四縣	交通	iuˇ lam  caˊ	遊覽車	tour bus	這擺校外教學愛坐遊覽車去。	這次校外教學要坐遊覽車去。
007	巴士	初級	四縣	交通	ba  siiˋ	公共汽車	bus	逐日坐巴士去上班。	我每天搭公共汽車去上班。
008	計程車（他庫西）	初級	四縣	交通	gie  cangˇ caˊ（taˇ ku  xiˋ）【ge  hangˇ caˊ】	計程車	taxi; cab	出門坐計程車當（蓋）方便。	出門坐計程車很方便。
009	轎車（矮嫲仔）	初級	四縣	交通	kieu  caˊ（aiˋmaˇ eˋ）【geuˊ  caˊ】	轎車	sedan	尖車當（蓋）艱苦，買輛轎車來駛較（過）贏。	擠車很辛苦，不如買輛轎車來開。
010	機車(奧多拜)【引擎】	初級	四縣	交通	giˊ caˊ（ oˊdo  baiˋ）【enˊ jinˋ】	機車	scooter; motorcycle	騎機車(引擎)定著愛戴安全帽。	騎機車一定要戴安全帽。
011	自行車【腳踏車】【自轉車】	初級	四縣	交通	cii  hangˇ caˊ【giogˋ tab caˊ】【cii  zonˋ caˊ】	自行車；鐵馬	bicycle	這下緊來緊多人騎自行車（自轉車）上下。	現在越來越多人騎自行車往來。
012	捷運	初級	四縣	交通	qiab   iun	捷運	MRT	坐捷運毋使等紅燈，加異（盡）遽。	搭捷運不必等紅燈，快多了。
013	高鐵	初級	四縣	交通	goˊtiedˋ	高鐵	high-speed railway	坐高鐵比坐火車貴，毋過加當（蓋）遽。	搭高鐵比搭火車貴，不過快很多。
014	流籠	初級	四縣	交通	liuˇ  longˇ【liuˇ  lungˇ】	纜車	cable car	識去坐過日月潭个流籠。	我曾坐過日月潭的纜車。
015	飛機場	初級	四縣	交通	fiˊ giˊ congˇ	飛機場	airport	香港新起个飛機場當（蓋）大。	香港新蓋的飛機場很大。
016	碼頭	初級	四縣	交通	maˊ teuˇ	碼頭	wharf	老弟當（蓋）愛去基隆碼頭看大船。	弟弟很喜歡去基隆碼頭看大船。
017	鐵路	初級	四縣	交通	tiedˋ lu	鐵軌	railway	基隆到新竹个鐵路，係劉銘傳造个。	基隆到新竹的鐵路，是劉銘傳造的。
018	車頭（車站）	初級	四縣	交通	caˊ teuˇ（caˊ zam）	車站	station	請問客運个車頭仰般行？	請問客運車站怎麼走？
019	火車頭	初級	四縣	交通	foˋ caˊ teuˇ	火車站	train station	臺北火車頭像市場樣仔，當（蓋）多人。	臺北火車站像市場一樣，很多人。
020	巴士站	初級	四縣	交通	ba  siiˋ zam	巴士站	bus station	火車頭脣就有巴士站 。	火車站旁邊就有巴士站 。
021	加油站	初級	四縣	交通	gaˊ iuˇ zam	加油站	gas station	車仔會無油吔，先去加油站加油。	車子快沒油了，先去加油站加油。
022	汽油	初級	四縣	交通	hi iuˇ	汽油	gasoline	你个車仔係用哪種汽油？	你的車子是用哪一種汽油？
023	天橋	初級	四縣	交通	tienˊ kieuˇ	天橋	overhead bridge	行天橋較（過）費氣，毋過較（過）安全。	走天橋比較麻煩，不過比較安全。
024	橋	初級	四縣	交通	kieuˇ	橋	bridge	媽祖廟當（蓋）近，過橋就到吔。	媽祖廟很近，過橋就到了。
025	地下道	初級	四縣	交通	ti  haˊ to	地下道	underpass	暗晡頭行地下道，較（過）得人驚。	晚上走地下道，比較可怕。
026	人行道	初級	四縣	交通	nginˇ  hangˇ  to	人行道	sidewalk	人行道係分行路人行个。	人行道是給路人走的。
027	窿	初級	四縣	交通	lungˇ【nungˇ】	隧道	tunnel	火車過窿，看毋着外背个風景。	火車過隧道，看不到外面的風景。
028	交通警察	初級	四縣	交通	gauˊ tungˊ ginˋ cadˋ	交通警察	traffic police	這條路係無交通警察，定著會塞車。	這條路如果沒交通警察，一定會塞車。
029	紅青燈	初級	四縣	交通	fungˇ qiangˊ denˊ	紅綠燈	traffic lights	過大路愛看紅青燈。	過馬路要看紅綠燈。
030	十字路口	初級	四縣	交通	siib  sii  lu  heuˋ	十字路口	intersection	在十字路口等你。	我在十字路口等你。
031	車牌	初級	四縣	交通	caˊ paiˇ	站牌	bus stop	你知263个車牌在哪位無？	你知道263的站牌在哪裡嗎？
032	優待票	初級	四縣	交通	iuˊ tai  peuˊ	優待票	discount ticket	有電影「海角七號」个優待票。	我有電影「海角七號」的優待票。
033	免費	初級	四縣	交通	mienˊ fi	免費	free of charge	這下，老人家坐公車免費。	現在，老人搭公車免費。
034	半票	初級	四縣	交通	ban  peuˊ	半票	half-fare ticket	細人仔坐車半票。	小孩子搭車半票。
035	退票	初級	四縣	交通	tui  peuˊ	退票	to get a refund for a ticket	退票愛扣手續費。	退票要扣手續費。
036	到站	初級	四縣	交通	do  zam	到站	to arrive at a station	車仔到站吔，遽遽下車。	車子到站了，趕快下車。
037	打單（買票）	初級	四縣	交通	daˋ danˊ（maiˊ peuˊ）	購票	to buy a ticket	無打單，做毋得上車。	沒買票，不可以上車。
038	騎馬	初級	四縣	交通	kiˇ  maˊ	騎馬	to ride a horse	騎馬係異（盡）好个運動。	騎馬是很好的運動。
039	撐船	初級	四縣	交通	cang  sonˇ	撐船	to row a boat	這條河壩無橋，愛撐船正過得去。	這條河沒有橋，要撐船才過得去。
040	停車	初級	四縣	交通	tinˇ caˊ	停車	to park a car	在臺北駛車仔，停車無方便。	在臺北開車，停車不方便。
041	坐車【坐車仔】	初級	四縣	交通	coˊ caˊ【coˊ caˊ eˋ】	乘車	to take a bus/taxi/train	坐車(坐車仔)个時節，頭那毋好探出去。	乘車的時候，頭不要探出去。
042	頭枋車	初級	四縣	交通	teuˇ  biongˊ caˊ	第一班車	first train/bus	天光日愛坐頭枋車去臺北。	明天我要搭頭班車去臺北。
043	尾枋車	初級	四縣	交通	miˊ biongˊ caˊ	尾班車	last train/bus	佢尾枋車無赴着，毋知愛仰結煞。	他末班車沒趕上，不知道該怎麼辦。
044	車禍	初級	四縣	交通	caˊ fo	車禍	traffic accident	路口出車禍，好得無人著傷。	路口出車禍，幸好沒人受傷。
001	杯仔	初級	四縣	器物用品	biˊ eˋ	杯子	cup	這隻杯仔無洗淨，請同換過隻。	這個杯子沒洗乾淨，請幫我換一個。
002	罐仔	初級	四縣	器物用品	gon  eˋ	瓶子	bottle	用過个罐仔，毋好忒。	用過的罐子，不要丟掉。
003	盎仔	初級	四縣	器物用品	angˊ eˋ	瓶子	bottle	盎仔肚个豆油伸無幾多吔。	瓶子裡的醬油剩沒多少了。
004	剪刀	初級	四縣	器物用品	jienˋ doˊ	剪刀	scissors	這支剪刀無利吔，拿去磨磨啊！	這把剪刀不利了，拿去磨一磨！
005	鈕仔【扣仔】	初級	四縣	器物用品	neuˋ eˇ【kieu eˋ】	鈕扣	button	細老弟曉得自家鈕鈕（扣扣）仔吔。	小弟會自己扣扣子了。
006	扇仔	初級	四縣	器物用品	san  eˋ	扇子	fan	坐在樹下撥扇仔該個老人家係吾公。	坐在樹下搧扇子那位老人是我爺爺。
007	目鏡【眼鏡】【眼架仔】	初級	四縣	器物用品	mugˋ giang 【ngianˋ giang】【ngianˋgaˊeˋ】	眼鏡	glasses	近視愛戴目鏡（眼鏡），正看得清楚。	近視要戴眼鏡，才看得清楚。
008	機器	初級	四縣	器物用品	giˊ hi	機器	machine	機器攪个粢粑仔較（過）無恁好食 （ 毋好食 ）。	機器絞的粢粑比較沒這麼好吃。
009	鑽仔	初級	四縣	器物用品	zon  eˋ	鑽子	drill	鑽空愛用鑽仔。	鑽孔要用鑽子。
010	扁鑽（多拉把）【鑽仔】	初級	四縣	器物用品	bienˋ zon(doˊ lai baˋ)【doˊ lai baˇ】【zon eˋ】	起子	driver	用扁鑽（鑚仔）來撙螺絲仔。	我用扁鑽來轉螺絲。
011	鐵鎚	初級	四縣	器物用品	tiedˋ cuiˇ	鐵鎚	hammer	阿爸擎鐵鎚來釘鐵釘仔。	爸爸拿鐵鎚來鎚釘子。
012	鉗仔	初級	四縣	器物用品	kiamˇ eˋ	老虎鉗	pincer,pliers	去拿鉗仔來剪鉛線仔。	去拿老虎鉗來剪鐵絲。
013	鐵釘仔【番釘】	初級	四縣	器物用品	tiedˋ dangˊ eˋ【fanˊdangˊ】	鐵釘	nail	這支鐵釘仔（番釘）忒細支，釘毋核。	這支鐵釘太小，釘不牢。
014	電線	初級	四縣	器物用品	tien  xien	電線	electric wrie	電線舊吔，愛換新（个）正較（過）安全。	電線舊了，要換新才比較安全。
015	隨身碟	初級	四縣	器物用品	suiˇ siinˊ tiab	隨身碟	flash drive	用隨身碟來保存電腦資料，當（蓋）利便。	用隨身碟來保存電腦資料，很方便。
016	光碟	初級	四縣	器物用品	gongˊ tiab	光碟	CD	光碟个儲存量當（蓋）大，放歸本書个資料無問題。	光碟的儲存量很大，放整本書的資料沒問題。
017	刀仔	初級	四縣	器物用品	doˊ eˋ	刀子	knife	刀仔愛放好，毋好分細人仔拿着。	刀子要放好，不要讓小孩子拿到。
018	菜刀	初級	四縣	器物用品	coi  doˊ	菜刀	kitchen chopper	金門菜刀當（蓋）有名。	金門菜刀很有名。
019	碗	初級	四縣	器物用品	vonˋ	碗	bowl	拿碗張飯，準備愛食飯吔。	我拿碗盛飯，準備要吃飯了。
020	碗公	初級	四縣	器物用品	vonˋ gungˊ	大碗	large bowl	去拿一隻碗公來張湯。	去拿一個大碗來裝湯。
021	盤仔	初級	四縣	器物用品	panˇ eˋ	盤子	plate	阿姆喊拿盤仔分佢張菜。	媽媽叫我拿盤子給他盛菜。
022	筷仔	初級	四縣	器物用品	kuai eˋ	筷子	chopsticks	西洋人毋慣擎筷仔。	西洋人不習慣拿筷子。
023	插仔	初級	四縣	器物用品	cabˋeˇ【cabˋ eˋ】	叉子	fork	食西瓜用插仔較(過)衛生。	吃西瓜用叉子比較衛生。
024	飯匙	初級	四縣	器物用品	fan  ciiˇ	飯匙	rice ladle	去拿飯匙來添飯！	去拿飯匙來盛飯！
025	湯匙【調羹仔】	初級	四縣	器物用品	tongˊ ciiˇ【tiauˇ gangˊ eˋ】	湯匙	spoon	食湯愛用湯匙（調羹仔）。	喝湯要用湯匙。
026	杓仔	初級	四縣	器物用品	sog  eˋ	杓子	ladle	去擎一支杓仔來舀水。	去拿一支杓子來舀水。
027	冰箱	初級	四縣	器物用品	benˊ xiongˊ	冰箱	refrigerator	食伸个菜愛放冰箱。	吃剩的菜要放冰箱。
028	微波爐	初級	四縣	器物用品	miˇ boˊ luˇ	微波爐	microwave	微波爐个輻射線當（蓋）強。	微波爐的輻射線很強。
029	烤箱	初級	四縣	器物用品	kauˋ xiongˊ	烤箱	oven	阿姆用烤箱焙煙腸。	媽媽用烤箱烤香腸。
030	暖壺（暖罐）	初級	四縣	器物用品	nonˊ fuˇ（nonˊ gon ）	熱水瓶	thermos bottle	桌頂有一隻暖壺。	桌上有一個熱水瓶。
